{
  "format": "GOVP-STATUS-1",
  "canonical": "https://govp.io/.well-known/govp/revoked.json",
  "publisher": "GOVP Protocol — Gemacode",
  "authority": "https-origin",
  "generated_at": "2026-08-05T22:07:54Z",
  "keys": [
    {
      "key_id": "sha256:41c4d691ddfa7abd6bd279abe6b59b074922c3f128160d6b2cf1937a74f2bbac",
      "public_key": "jgLoQnTwnFLl8uXniEg2INX91Lxao1r8+ikmLQp8wOE=",
      "state": "active",
      "changed_at": "2026-08-05T20:58:38Z"
    },
    {
      "key_id": "sha256:8a94ece8bca36850accdb79be665446bf7093e4d68b3d5673c208d24cbe04294",
      "public_key": "3ssRh9xsWjxWlkK7zz6kpnCKCEdCr9ZfSR20e8g2Cic=",
      "state": "active",
      "changed_at": "2026-08-06T13:55:04Z"
    },
    {
      "key_id": "sha256:6d72ef19eb387527da85c344bdca5e9f1ac4b48fa8019b30d772d14d4c7fee26",
      "public_key": "YSSXXH7Amr7uhgkuKzRgGe7nGF6zjjHpbTIUfV5AWD8=",
      "state": "active",
      "changed_at": "2026-08-11T00:00:00Z"
    },
    {
      "key_id": "sha256:cfb9c341eb48d3cfb8e4bdfabc994c8abaccbb3fe8c7386c638101be54c586c9",
      "public_key": "bxL1FZJ/IbNcy8N6G2jybxvj4WJQ4emOeay/qiEQY5w=",
      "state": "active",
      "changed_at": "2026-08-11T00:00:00Z"
    }
  ],
  "revoked_records": []
}
